{
  "schema": "scfs-help-desk-case/1.0",
  "version": "6.1.0",
  "case_number": "SC-2026-000184",
  "requester_ref": "contact-engagement:inquiry-184",
  "organization_ref": "organization:example-institution",
  "product": "decision-studio",
  "product_version": "2.0.1",
  "component": "briefing",
  "subject": "Decision brief export is unavailable",
  "description": "The supported PDF export workflow returns an error after the briefing is generated.",
  "case_type": "unexpected_behavior",
  "priority": "p2_high",
  "severity": "major",
  "status": "open",
  "source": "contact_engagement",
  "privacy_classification": "private_support",
  "consent_state": "recorded",
  "assigned_user_id": 0,
  "assigned_team": "Decision Studio Support",
  "created_at": "2026-07-19T21:00:00Z",
  "updated_at": "2026-07-19T21:12:00Z",
  "relationships": [
    {
      "relationship_type": "affected_by",
      "related_record_type": "known_issue",
      "related_record_id": 44,
      "related_record_key": "",
      "public_context_only": true
    },
    {
      "relationship_type": "supported_by",
      "related_record_type": "support_article",
      "related_record_id": 812,
      "related_record_key": "",
      "public_context_only": true
    }
  ],
  "privacy": {
    "public_case_api": false,
    "public_case_shortcode": false,
    "identity_authority": "contact-engagement",
    "attachment_authority": "contact-engagement",
    "private_case_content_exposed": false,
    "automatic_case_creation": false
  }
}
